<?xml version="1.0" encoding="EUC-KR"?>
<NOM:Nex1ObjectModel xmlns:NOM="lignex1.sw.nframework.NOM" xmlns:xsi="http://www.w3.org/2001/XMLSchema-instance" xsi:schemaLocation="lignex1.sw.nframework.NOM NOM.xsd" version="0.1" name="ATSCommunicationManager" date="2021-02-09" author="Junyong Shim, LIGNex1">
	<!--  object data  -->
	<NOM:objects>
		<!--  packet data  -->
	</NOM:objects>
	<!--  interaction data  -->
	<NOM:interactions>
		<NOM:interaction name="MSL_POSITION" id="1006" sharing="Neither" orderType="Receive" alignment="false">
			<NOM:parameter name="MessageId" dataType="UnsignedIntegerBE"/>
			<NOM:parameter name="MessageSize" dataType="UnsignedIntegerBE"/>
			<NOM:parameter name="MissileCurX" dataType="FloatBE"/>
			<NOM:parameter name="MissileCurY" dataType="FloatBE"/>
			<NOM:parameter name="IsShotDown" dataType="UnsignedIntegerBE"/>
		</NOM:interaction>
		<NOM:interaction name="ATS_POSITION" id="1008" sharing="Subscribe" orderType="Receive" alignment="false">
			<NOM:parameter name="MessageId" dataType="UnsignedIntegerBE"/>
			<NOM:parameter name="MessageSize" dataType="UnsignedIntegerBE"/>
			<NOM:parameter name="EnemyCurX" dataType="FloatBE"/>
			<NOM:parameter name="EnemyCurY" dataType="FloatBE"/>
		</NOM:interaction>
		<NOM:interaction name="ATS_POSITION_TO_MSL" id="2008" sharing="Publish" orderType="Receive" alignment="false">
			<NOM:parameter name="MessageId" dataType="UnsignedIntegerBE"/>
			<NOM:parameter name="MessageSize" dataType="UnsignedIntegerBE"/>
			<NOM:parameter name="EnemyCurX" dataType="FloatBE"/>
			<NOM:parameter name="EnemyCurY" dataType="FloatBE"/>
		</NOM:interaction>
		<NOM:interaction name="SCN_DEPLOY" id="1001" sharing="Subscribe" orderType="Receive" alignment="false">
			<NOM:parameter name="MessageId" dataType="UnsignedIntegerBE"/>
			<NOM:parameter name="MessageSize" dataType="UnsignedIntegerBE"/>
			<NOM:parameter name="EnemyInitX" dataType="FloatBE"/>
			<NOM:parameter name="EnemyInitY" dataType="FloatBE"/>
			<NOM:parameter name="EnemyDestX" dataType="FloatBE"/>
			<NOM:parameter name="EnemyDestY" dataType="FloatBE"/>
			<NOM:parameter name="EnemySpeed" dataType="FloatBE"/>
			<NOM:parameter name="EnemyType" dataType="UnsignedIntegerBE"/>
			<NOM:parameter name="EnemyAngle" dataType="FloatBE"/>
			<NOM:parameter name="MissileInitX" dataType="FloatBE"/>
			<NOM:parameter name="MissileInitY" dataType="FloatBE"/>
			<NOM:parameter name="MissileSpeed" dataType="FloatBE"/>
			<NOM:parameter name="RadarInitX" dataType="FloatBE"/>
			<NOM:parameter name="RadarInitY" dataType="FloatBE"/>
			<NOM:parameter name="LauncherInitX" dataType="FloatBE"/>
			<NOM:parameter name="LauncherInitY" dataType="FloatBE"/>
			<NOM:parameter name="LauncherStock" dataType="UnsignedIntegerBE"/>
		</NOM:interaction>
		<NOM:interaction name="SIM_CONTROL" id="1002" sharing="Subscribe" orderType="Receive" alignment="false">
			<NOM:parameter name="MessageId" dataType="UnsignedIntegerBE"/>
			<NOM:parameter name="MessageSize" dataType="UnsignedIntegerBE"/>
			<NOM:parameter name="OperationType" dataType="UnsignedIntegerBE"/>
		</NOM:interaction>
		<NOM:interaction name="SIM_CONTROL_ATS_ROS" id="2002" sharing="Publish" orderType="Receive" alignment="false">
			<NOM:parameter name="MessageId" dataType="UnsignedIntegerBE"/>
			<NOM:parameter name="MessageSize" dataType="UnsignedIntegerBE"/>
			<NOM:parameter name="OperationType" dataType="UnsignedIntegerBE"/>
		</NOM:interaction>
		<NOM:interaction name="SIM_CONTROL_MSL_LOS" id="3002" sharing="Publish" orderType="Receive" alignment="false">
			<NOM:parameter name="MessageId" dataType="UnsignedIntegerBE"/>
			<NOM:parameter name="MessageSize" dataType="UnsignedIntegerBE"/>
			<NOM:parameter name="OperationType" dataType="UnsignedIntegerBE"/>
		</NOM:interaction>
		<NOM:interaction name="SIM_STATUS" id="1003" sharing="Publish" orderType="Receive" alignment="false">
			<NOM:parameter name="MessageId" dataType="UnsignedIntegerBE"/>
			<NOM:parameter name="MessageSize" dataType="UnsignedIntegerBE"/>
			<NOM:parameter name="SimulatorState" dataType="UnsignedIntegerBE"/>
		</NOM:interaction>
		<NOM:interaction name="ROS_DETECTION" id="1004" sharing="Publish" orderType="Receive" alignment="false">
			<NOM:parameter name="MessageId" dataType="UnsignedIntegerBE"/>
			<NOM:parameter name="MessageSize" dataType="UnsignedIntegerBE"/>
			<NOM:parameter name="IsDetected" dataType="UnsignedIntegerBE"/>
		</NOM:interaction>
		<NOM:interaction name="MSL_LAUNCH" id="1005" sharing="Subscribe" orderType="Receive" alignment="false">
			<NOM:parameter name="MessageId" dataType="UnsignedIntegerBE"/>
			<NOM:parameter name="MessageSize" dataType="UnsignedIntegerBE"/>
		</NOM:interaction>
		<NOM:interaction name="ATS_SHOT_DOWN" id="1007" sharing="Neither" orderType="Receive" alignment="false">
			<NOM:parameter name="MessageId" dataType="UnsignedIntegerBE"/>
			<NOM:parameter name="MessageSize" dataType="UnsignedIntegerBE"/>
		</NOM:interaction>
	</NOM:interactions>
	<!--  data types  -->
	<NOM:dataTypes>
		<NOM:basicTypes>
			<NOM:basicType name="Boolean" length="1" endian="little" type="Bool" note="8bit value"/>
			<NOM:basicType name="IntegerBE" length="4" endian="big" type="Integer" note="32bit integer, big endian"/>
			<NOM:basicType name="Integer" length="4" endian="little" type="Integer" note="32bit integer, little endian"/>
			<NOM:basicType name="UnsignedIntegerBE" length="4" endian="big" signed="false" type="Integer" note="32bit unsigned integer, big endian"/>
			<NOM:basicType name="UnsignedInteger" length="4" endian="little" signed="false" type="Integer" note="32bit unsigned integer, little endian"/>
			<NOM:basicType name="Octet" length="1" endian="little" type="Byte" note="8bit value"/>
			<NOM:basicType name="ShortBE" length="2" endian="big" type="Short" note="16bit integer(short), big endian"/>
			<NOM:basicType name="Short" length="2" endian="little" type="Short" note="16bit integer(short), little endian"/>
			<NOM:basicType name="UnsignedShortBE" length="2" endian="big" signed="false" type="Short" note="16bit unsigned integer(short), big endian"/>
			<NOM:basicType name="UnsignedShort" length="2" endian="little" signed="false" type="Short" note="16bit unsigned integer(short), little endian"/>
			<NOM:basicType name="FloatBE" length="4" endian="big" type="Float" note="32bit float, big endian"/>
			<NOM:basicType name="Float" length="4" endian="little" type="Float" note="32bit float, little endian"/>
			<NOM:basicType name="DoubleBE" length="8" endian="big" type="Double" note="32bit double, little endian"/>
			<NOM:basicType name="Double" length="8" endian="little" type="Double" note="32bit double, little endian"/>
			<NOM:basicType name="Char" length="1" endian="none" type="Char" note="8bit char value"/>
			<NOM:basicType name="UnsignedChar" length="1" endian="none" signed="false" type="Char" note="8bit char value"/>
			<NOM:basicType name="Byte" length="1" endian="none" signed="false" type="Byte" note="8bit byte value"/>
			<NOM:basicType name="String" length="0" endian="none" signed="false" type="String" note="String"/>
			<NOM:basicType name="Var" length="0" endian="none" signed="false" type="Variable" note="Variable"/>
		</NOM:basicTypes>
		<NOM:enumerationTypes>
			<NOM:enumerationType name="TestEnum16" length="2">
				<NOM:enumerator name="Start" value="1"/>
				<NOM:enumerator name="Stop" value="2"/>
			</NOM:enumerationType>
		</NOM:enumerationTypes>
		<NOM:complexTypes>
			<NOM:complexType name="TestStruct">
				<NOM:fieldType name="X" dataType="FloatBE"/>
				<NOM:fieldType name="Y" dataType="FloatBE"/>
				<NOM:fieldType name="Z" dataType="FloatBE"/>
			</NOM:complexType>
		</NOM:complexTypes>
	</NOM:dataTypes>
	<NOM:notes> </NOM:notes>
</NOM:Nex1ObjectModel>
