<?xml version="1.0" encoding="euc-kr"?>
<NOM:Nex1ObjectModel xmlns:NOM="lignex1.sw.nframework.NOM" xmlns:xsi="http://www.w3.org/2001/XMLSchema-instance" xsi:schemaLocation="lignex1.sw.nframework.NOM NOM.xsd"
    version="1.7" name="UI_NOM" date="2020-02-01" author="Junyong Shim, LIGNex1">
  <!-- object data -->
  <NOM:objects>
    <NOM:object name="ICD_Test1" id="111" nameNotes="ICD의 Test1 메시지" sharing="Subscribe" orderType="Receive" alignment="false">
      <NOM:attribute name="SystemTime1" nameNotes="Logging Time - sec"  dataType="UnsignedIntegerBE"/>
      <NOM:attribute name="SystemTime2" nameNotes="Logging Time - millisec"  dataType="UnsignedIntegerBE"/>
      <NOM:attribute name="Message1" nameNotes="수신 메시지 1" dataType="UnsignedIntegerBE"/>
      <NOM:attribute name="Message2" nameNotes="수신 메시지 2" dataType="UnsignedIntegerBE"/>
    </NOM:object>
  </NOM:objects>
  <!-- interaction data -->
  <NOM:interactions>
    <NOM:interaction name="GUI_Start" id="1001" nameNotes="시험정보 수집 시작" sharing="Publish" orderType="Receive" alignment="false">
      <NOM:parameter name="Message1" dataType="UnsignedIntegerBE" />
    </NOM:interaction>
  </NOM:interactions>
  <!-- data types -->
  <NOM:dataTypes>
    <NOM:basicTypes>
      <NOM:basicType name="Boolean" length="1" endian="little" type="Bool" note="8bit value"/>
      <NOM:basicType name="IntegerBE" length="4" endian="big" type="Integer" note="32bit integer, big endian"/>
      <NOM:basicType name="Integer" length="4" endian="little" type="Integer" note="32bit integer, little endian"/>
      <NOM:basicType name="UnsignedIntegerBE" length="4" endian="big" signed="false" type="Integer" note="32bit unsigned integer, big endian"/>
      <NOM:basicType name="UnsignedInteger" length="4" endian="little" signed="false" type="Integer" note="32bit unsigned integer, little endian"/>
      <NOM:basicType name="Octet" length="1" endian="little" type="Byte" note="8bit value"/>
      <NOM:basicType name="ShortBE" length="2" endian="big" type="Short" note="16bit integer(short), big endian"/>
      <NOM:basicType name="Short" length="2" endian="little" type="Short" note="16bit integer(short), little endian"/>
      <NOM:basicType name="UnsignedShortBE" length="2" endian="big" signed="false" type="Short" note="16bit unsigned integer(short), big endian"/>
      <NOM:basicType name="UnsignedShort" length="2" endian="little" signed="false" type="Short" note="16bit unsigned integer(short), little endian"/>
      <NOM:basicType name="FloatBE" length="4" endian="big" type="Float" note="32bit float, big endian"/>
      <NOM:basicType name="Float" length="4" endian="little" type="Float" note="32bit float, little endian"/>
      <NOM:basicType name="DoubleBE" length="8" endian="big" type="Double" note="32bit double, little endian"/>
      <NOM:basicType name="Double" length="8" endian="little" type="Double" note="32bit double, little endian"/>
      <NOM:basicType name="Char" length="1" endian="none" type="Char" note="8bit char value"/>
      <NOM:basicType name="UnsignedChar" length="1" endian="none" signed="false" type="Char" note="8bit char value"/>
      <NOM:basicType name="Byte" length="1" endian="none" signed="false" type="Byte" note="8bit byte value"/>
      <NOM:basicType name="String" length="0" endian="none" signed="false" type="String" note="String"/>
      <NOM:basicType name="Var" length="0" endian="none" signed="false" type="Variable" note="Variable"/>
    </NOM:basicTypes>
    <NOM:enumerationTypes>
      <NOM:enumerationType name="TestEnum16" length="2">
        <NOM:enumerator name="Start" value="1" />
        <NOM:enumerator name="Stop" value="2" />
      </NOM:enumerationType>
    </NOM:enumerationTypes>
    <NOM:complexTypes>
      <NOM:complexType name="TestStruct">
        <NOM:fieldType name="X" dataType="FloatBE" />
        <NOM:fieldType name="Y" dataType="FloatBE" />
        <NOM:fieldType name="Z" dataType="FloatBE" />
      </NOM:complexType>
    </NOM:complexTypes>
  </NOM:dataTypes>
  <NOM:notes>
  </NOM:notes>
</NOM:Nex1ObjectModel>